{
  "schema_id": "orgsmith/authoring-deliverable@1",
  "work_order_id": "wo:author:0007",
  "generator": {
    "model": "claude-opus-4-8[1m]",
    "effort": "xhigh"
  },
  "docs": [
    {
      "schema_id": "orgsmith/docir@1",
      "doc_id": "d:0025",
      "blocks": [
        {
          "kind": "heading",
          "text": "Status Report: Post-Merger Integration for {{fact:f:E-2009-003.client}}",
          "level": 1,
          "items": [],
          "header": [],
          "rows": [],
          "signers": []
        },
        {
          "kind": "paragraph",
          "text": "Reporting period ending 22 June 2009. Prepared by Daniel Leach, Advisory, for the client's leadership; the engagement is led by Jason Torres, Principal.",
          "level": 1,
          "items": [],
          "header": [],
          "rows": [],
          "signers": []
        },
        {
          "kind": "paragraph",
          "text": "In short, the integration of Carroll, Merritt and Williams is on plan and within budget at the midpoint of the engagement, and no item now open is likely to move the target dates. What follows sets out, in order, the position at this stage, the work completed since the last report, the state of the budget, the work planned for the coming period, and the two matters on which the client must decide. I have put the conclusion first; the detail below is meant to support it.",
          "level": 1,
          "items": [],
          "header": [],
          "rows": [],
          "signers": []
        },
        {
          "kind": "heading",
          "text": "Position at This Stage",
          "level": 2,
          "items": [],
          "header": [],
          "rows": [],
          "signers": []
        },
        {
          "kind": "paragraph",
          "text": "We have passed the midpoint of the engagement, and the work has moved from understanding the two combined businesses to designing how the joined company will run. The current-state review is complete and was accepted by the client, and the statement of integration priorities that came out of it has been agreed with the leadership of {{fact:f:E-2009-003.client}}. Four areas are now in progress against those priorities: the design of the combined support functions, the validation of the first-year savings, the sequencing of the changes, and the handling of the customer-facing operations. Three of the four are on their planned course. The fourth, the savings validation, carries the single open dependency described below, which is why I have recorded a risk rather than reported the period as wholly clean.",
          "level": 1,
          "items": [],
          "header": [],
          "rows": [],
          "signers": []
        },
        {
          "kind": "heading",
          "text": "Completed Since the Last Report",
          "level": 2,
          "items": [],
          "header": [],
          "rows": [],
          "signers": []
        },
        {
          "kind": "paragraph",
          "text": "The following were finished in this period, each set against the priority it serves.",
          "level": 1,
          "items": [],
          "header": [],
          "rows": [],
          "signers": []
        },
        {
          "kind": "list",
          "text": "",
          "level": 1,
          "items": [
            "Combined support-function design. The target structure for the shared support functions was drafted and reviewed with the client, and the affected role descriptions are written and now in review. This is where the two operating models overlap most, and where early consolidation was always the most likely.",
            "Savings baseline. From the reconciled cost baseline I assembled a first schedule of candidate savings, and separated those realizable in the first year from those that depend on existing contracts running their course, following the caution the client's finance team raised at the working session.",
            "Peer and market context. Mary Parker completed the comparison against the closest peers and filed the sources with the schedule, so that any figure the client questions can be traced to where it came from.",
            "Sequencing plan. A first order for the combined changes was laid out so that the organization can absorb them without losing a step, and it is ready for review at the next session."
          ],
          "header": [],
          "rows": [],
          "signers": []
        },
        {
          "kind": "heading",
          "text": "Budget",
          "level": 2,
          "items": [],
          "header": [],
          "rows": [],
          "signers": []
        },
        {
          "kind": "paragraph",
          "text": "The engagement is billed against a fixed fee of {{fact:f:E-2009-003.fee}}. Approximately half of that amount has been earned as of this report, which matches the share of the planned work now complete; on the current projection the remaining work can be delivered within the fixed fee, and no further authorization is anticipated. I would enter one qualification. If the savings validation requires access and analysis beyond what the plan assumes, the additional effort could press against the fee; should that occur, we will bring it to the client for a decision before the work is begun.",
          "level": 1,
          "items": [],
          "header": [],
          "rows": [],
          "signers": []
        },
        {
          "kind": "heading",
          "text": "Planned for the Coming Period",
          "level": 2,
          "items": [],
          "header": [],
          "rows": [],
          "signers": []
        },
        {
          "kind": "list",
          "text": "",
          "level": 1,
          "items": [
            "Complete the combined support-function design and issue the finalized role descriptions to the client for approval.",
            "Close the savings validation, subject to the access noted below, and present the first-year figure separately from the amount that rests on existing contracts.",
            "Confirm the sequencing plan with the client's leadership so that implementation can begin against an agreed order.",
            "Prepare the mid-engagement briefing that draws the three streams into a single view of where the integration stands."
          ],
          "header": [],
          "rows": [],
          "signers": []
        },
        {
          "kind": "heading",
          "text": "Matters Needing a Decision",
          "level": 2,
          "items": [],
          "header": [],
          "rows": [],
          "signers": []
        },
        {
          "kind": "paragraph",
          "text": "Two decisions rest with the client before the coming period can proceed as planned. I have set out each one and what it holds up.",
          "level": 1,
          "items": [],
          "header": [],
          "rows": [],
          "signers": []
        },
        {
          "kind": "list",
          "text": "",
          "level": 1,
          "items": [
            "Access to the retained-contract records of Carroll, Merritt and Williams. The savings validation cannot separate the durable savings from those bound up in existing contracts until the team can see the underlying contract terms, which have not yet been made available to us. This is the one dependency now holding a stream off its planned course.",
            "Approval of the combined role descriptions. The finalized descriptions are ready to issue, but they cannot go to the affected managers until the client's leadership has approved the language, and a delay here would move the organization announcements past the point the sequencing plan assumes."
          ],
          "header": [],
          "rows": [],
          "signers": []
        },
        {
          "kind": "heading",
          "text": "Assessment",
          "level": 2,
          "items": [],
          "header": [],
          "rows": [],
          "signers": []
        },
        {
          "kind": "paragraph",
          "text": "Taken together, the engagement is where it should be at the midpoint, and the risks that remain are ones the client is placed to resolve directly rather than ones inherent in the work itself. Jason Torres will take this report to the client's leadership at the standing review and can carry either decision on that call. The action that most affects the coming period is access to the Carroll, Merritt and Williams contract records; securing it this week keeps the savings validation on its planned course, and I will send the specific list of records we need as soon as this report is in your hands.",
          "level": 1,
          "items": [],
          "header": [],
          "rows": [],
          "signers": []
        }
      ]
    }
  ]
}
