{
  "schema_id": "orgsmith/authoring-deliverable@1",
  "work_order_id": "wo:author:0013",
  "generator": {
    "model": "claude-opus-5",
    "effort": "xhigh"
  },
  "docs": [
    {
      "schema_id": "orgsmith/docir@1",
      "doc_id": "d:0063",
      "blocks": [
        {
          "kind": "heading",
          "level": 1,
          "text": "Compensation Benchmarking for {{fact:f:E-2023-001.client}}: Closing Status Report"
        },
        {
          "kind": "paragraph",
          "text": "Field work closed in this period. All five job families in scope have a matched comparator set, every band has been through a second review, and the report is written and with Sandra Fuentes for her read before it reaches the committee. The closing session stands where it was put in the diary."
        },
        {
          "kind": "paragraph",
          "text": "Two roles inside the commercial family are carried at low confidence and are marked as such on the face of the report. Nothing else in the file carries a qualification."
        },
        {
          "kind": "heading",
          "level": 2,
          "text": "State of the file"
        },
        {
          "kind": "paragraph",
          "text": "The comparator counts below are matches that survived the second review. The raw pulls were larger in every family and are kept in the working papers."
        },
        {
          "kind": "table",
          "header": [
            "Job family",
            "Roles benchmarked",
            "Matched comparators",
            "State"
          ],
          "rows": [
            [
              "Executive and general management",
              "6",
              "38",
              "Closed"
            ],
            [
              "Finance and accounting",
              "9",
              "52",
              "Closed"
            ],
            [
              "Operations and plant",
              "14",
              "61",
              "Closed"
            ],
            [
              "Commercial and sales",
              "11",
              "44",
              "Closed, two roles at low confidence"
            ],
            [
              "Technical and professional",
              "17",
              "58",
              "Closed"
            ]
          ]
        },
        {
          "kind": "paragraph",
          "text": "The two commercial roles are the ones with a regional element in the pay. Fewer than ten clean matches were found for either inside the geography agreed at the autumn working session, and widening the geography to reach a larger set would have bought volume at the cost of comparability. Both are reported with the match count printed beside the band rather than smoothed into it."
        },
        {
          "kind": "heading",
          "level": 2,
          "text": "Changes since the last report"
        },
        {
          "kind": "list",
          "items": [
            "1. The survey cut was refreshed. Two of the subscription sources published after the last report and were re-run in full; the third had not moved and was carried forward with its effective date noted in the method appendix.",
            "2. Every band was reviewed a second time by Sandra Fuentes, who reads matches against the job descriptions and not against the titles. Three matches were rejected on that pass and redrawn.",
            "3. Base pay, target incentive and incentive actually paid are separated in the tables now. The committee asked for that at the autumn session, and it changes how two of the families read.",
            "4. The regional differential was applied to the operations and technical families and not to the executive family, where the comparator market is national. The reasoning sits in the method appendix so that it can be argued with.",
            "5. The internal equity read was completed across the whole scope. It was not in the original plan and was absorbed."
          ]
        },
        {
          "kind": "heading",
          "level": 2,
          "text": "What the data shows"
        },
        {
          "kind": "paragraph",
          "text": "The headline is narrower than the committee may be expecting. In three of the five families the current structure sits inside the middle of the market range and needs no action at all. In one it sits below the lower quartile at the senior end, and in one it sits above the upper quartile in a single role."
        },
        {
          "kind": "paragraph",
          "text": "The structural finding is compression. Two levels in operations are paid inside a band the market keeps separate, which shows up in the file as a promotion carrying no meaningful step in pay. It is the finding most likely to cost the client a good operator in the coming year and the hardest of them to fix inside one budget cycle."
        },
        {
          "kind": "paragraph",
          "text": "Where the current structure sits above the market, the report says so in the same terms it uses where the structure sits below. The method did not change on either side of the median, so the two directions can be read against each other."
        },
        {
          "kind": "heading",
          "level": 2,
          "text": "Fee"
        },
        {
          "kind": "paragraph",
          "text": "The work has been done inside the fixed fee of {{fact:f:E-2023-001.fee}} set in the engagement agreement. No variation has been raised at any point, the internal equity read included."
        },
        {
          "kind": "paragraph",
          "text": "Expenses are billed at cost and are below the projection carried in the plan. They are itemized on the schedule that travels with the final invoice."
        },
        {
          "kind": "heading",
          "level": 2,
          "text": "Ahead of the closing session"
        },
        {
          "kind": "list",
          "items": [
            "1. Two hours in the room, with the members who will vote on the structure present. A one-hour walkthrough leaves no time for the operations question, and the operations question is the one worth the meeting.",
            "2. A decision on circulation: whether the bands go to line managers with the report or after the structure decision. Sandra Fuentes will put it at the top of the session if it has not been settled before then.",
            "3. The three job descriptions still in draft on the client's side. David Weiss will re-run those matches inside two days of receiving them, and the report can be reissued with the roles included at no charge."
          ]
        },
        {
          "kind": "heading",
          "level": 2,
          "text": "What to watch once the report is in hand"
        },
        {
          "kind": "list",
          "items": [
            "1. The data ages on a published cycle. Bands in the deep families hold for roughly a year. The two thin commercial roles should be re-tested before either is used to set an offer.",
            "2. Bands travel faster than decisions do. In our experience, once a benchmarking report has reached line managers ahead of the structure decision, the pay conversation starts inside the business with nobody yet able to answer it.",
            "3. The compression finding will be read as an argument for a general increase. It is not one. It is an argument for separating two levels, and the report is written to make that distinction hard to miss."
          ]
        },
        {
          "kind": "paragraph",
          "text": "The working papers stay on the Hicks-Castillo file here: the source sheets, the match log with every rejected match and the reason it was rejected, and the correspondence with the two publishers about their effective dates. Any single family can be re-run from them without repeating the field work. Sandra Fuentes holds the report and takes the session; questions on method come to the research side."
        },
        {
          "kind": "sigblock",
          "signers": [
            "p:david.weiss"
          ]
        }
      ]
    }
  ]
}
