{
 "schema_id": "orgsmith/authoring-deliverable@1",
 "work_order_id": "wo:author:0008",
 "generator": {
  "model": "claude-opus-5",
  "effort": "xhigh"
 },
 "docs": [
  {
   "schema_id": "orgsmith/docir@1",
   "doc_id": "d:0036",
   "blocks": [
    {
     "kind": "heading",
     "text": "Head of Operations Search for {{fact:f:E-2018-001.client}}: Closing Session",
     "level": 1
    },
    {
     "kind": "paragraph",
     "text": "Ninety minutes at the client's offices. The purpose was to settle what remains after the acceptance, and nothing in the session reopened a decision already taken. Recorded by Nicole Donovan, copies to those present and to the search file."
    },
    {
     "kind": "heading",
     "text": "Present",
     "level": 2
    },
    {
     "kind": "list",
     "items": [
      "James Grant, Senior Consultant, Northgate Talent Partners",
      "Nicole Donovan, Research Associate, Northgate Talent Partners",
      "Jason Vasquez, General Manager, {{fact:f:E-2018-001.client}}"
     ]
    },
    {
     "kind": "heading",
     "text": "The acceptance",
     "level": 2
    },
    {
     "kind": "paragraph",
     "text": "The offer has been accepted and the search is closed in substance, with the notice period and the start date the only things now standing between here and the appointment. James Grant reported that the signed letter came back last week and that the candidate told her employer the next morning, which is the point at which we stop treating an acceptance as provisional, and she has asked for no change to the terms since."
    },
    {
     "kind": "paragraph",
     "text": "Jason Vasquez asked how she reads the counteroffer risk. James Grant said her employer has already made one and she declined it inside a day, and that he intends to keep the weekly calls running through the whole of her notice rather than treat the question as answered."
    },
    {
     "kind": "heading",
     "text": "How she is described until she starts",
     "level": 2
    },
    {
     "kind": "paragraph",
     "text": "She is not named in this record and she stays unnamed in anything that circulates at {{fact:f:E-2018-001.client}} until she has worked her last day where she is, which is our practice on every search and not a courtesy particular to this one. Jason Vasquez agreed to it without argument and has told the operations group that a hire is made without saying who. He would rather announce once, with a date attached, than announce twice."
    },
    {
     "kind": "heading",
     "text": "References",
     "level": 2
    },
    {
     "kind": "paragraph",
     "text": "References were complete before the offer went out and none of them qualified the recommendation. Two of the four had managed her directly, one was a peer, one a former direct report, and the written report went to Jason Vasquez alone and was copied no further. He asked whether it should go to the two managers who will report to her, and James Grant said no, on the ground that a reference is given to the client and not to a department."
    },
    {
     "kind": "heading",
     "text": "The first month",
     "level": 2
    },
    {
     "kind": "paragraph",
     "text": "The one question left open in the session is how much of the first month is handover from the interim arrangement, and that one belongs to the client. Jason Vasquez wants the site visits done inside the first two weeks so that she meets the operation before she meets the reporting on it. James Grant suggested the expectation be written into the welcome letter rather than left to be discovered in week three."
    },
    {
     "kind": "heading",
     "text": "Closing the file",
     "level": 2
    },
    {
     "kind": "paragraph",
     "text": "What is left on our side is the final invoice, the closeout file, and the replacement undertaking in the engagement letter, which runs twelve months from the day she starts. Nicole Donovan will assemble the file: the approved position specification, the slate with the written appraisals, the reference report, and the correspondence."
    },
    {
     "kind": "paragraph",
     "text": "James Grant asked that the client's own record of the search be squared with ours before either is put away, since two versions of a candidate list is the ordinary way a name gets out. Jason Vasquez will send his copies of the slate material back to us to be destroyed with ours."
    },
    {
     "kind": "heading",
     "text": "Actions agreed",
     "level": 2
    },
    {
     "kind": "table",
     "header": [
      "Owner",
      "Action",
      "By when"
     ],
     "rows": [
      [
       "Jason Vasquez",
       "Confirm the start date once notice has been served, and hold the internal announcement until it is fixed",
       "On receipt"
      ],
      [
       "James Grant",
       "Weekly call with the candidate through the notice period, and word to the client the same day if anything moves",
       "Weekly, to start"
      ],
      [
       "Jason Vasquez",
       "Settle the handover question with the interim and write the first-month expectations into the welcome letter",
       "Before she starts"
      ],
      [
       "Nicole Donovan",
       "Assemble the closeout file and return or destroy the slate material held on both sides",
       "Two weeks"
      ],
      [
       "James Grant",
       "Raise the final invoice against the engagement letter and send it with the closeout file",
       "Two weeks"
      ]
     ]
    },
    {
     "kind": "paragraph",
     "text": "Nothing in the session required a decision from the firm. The next entry in this file is the confirmed start date, and these minutes go this afternoon to the three of us who were in the room and into the client folder."
    }
   ]
  }
 ]
}
